{
  "protocolVersion": "cloudctl.mobile/v1",
  "taskId": "task-oneplus9r-smoke-001",
  "deviceId": "oneplus9r-b0644fb5",
  "targetPackage": "com.company.cloudctl.companion",
  "issuedAt": "2026-09-01T08:00:00Z",
  "expiresAt": "2026-09-01T08:10:00Z",
  "maxRunSeconds": 120,
  "steps": [
    {
      "stepId": "find-title",
      "action": "ui.find",
      "timeoutMs": 5000,
      "locatorRef": "companion.title"
    },
    {
      "stepId": "assert-title",
      "action": "ui.assert",
      "timeoutMs": 5000,
      "locatorRef": "companion.title",
      "predicate": "EXISTS"
    },
    {
      "stepId": "capture-status",
      "action": "ui.screenshot",
      "timeoutMs": 10000,
      "label": "companion-status"
    },
    {
      "stepId": "finish-log",
      "action": "run.log",
      "timeoutMs": 1000,
      "level": "INFO",
      "messageCode": "SMOKE_COMPLETED"
    }
  ]
}
